{
  "schema_version": "1.0.0",
  "reference_date": "2026-10-16",
  "catalog_snapshot_id": "eurorust-2026-71f2ee4aea59a1589532",
  "discovery_sha256": "7c62f8e001ee23af6ce97c47b736dc8ebc4ef8caf4bf83a9c4eab323bec1f991",
  "review_status": "Codex-assisted curation; community review pending. Page review is not proof of access, attendance, or current availability.",
  "communities": [
    {
      "id": "rust-project",
      "name": "Rust Project community",
      "kind": "organization",
      "affiliation": "rust_project",
      "region": "global",
      "location": null,
      "source_languages": [
        "en"
      ],
      "topics": [
        "community"
      ],
      "url": "https://rust-lang.org/community/",
      "discovery_source_id": "rust-community",
      "purpose": "Find official discussion and event-organizing routes.",
      "first_step": "Choose user help, language development, or event guidance before posting.",
      "access": {
        "mode": "online",
        "cost": null,
        "spoken_languages": null,
        "captions": null,
        "eligibility": null,
        "equipment": null,
        "venue": null,
        "room": null
      },
      "activity": {
        "observed_on": null,
        "evidence_url": "https://rust-lang.org/community/",
        "note": "Participation information inspected; no recent activity date established."
      },
      "review": {
        "checked_on": "2026-10-16",
        "next_review_on": "2027-01-14",
        "source_review": "page_checked",
        "evidence_urls": [
          "https://rust-lang.org/community/"
        ],
        "limits": []
      },
      "audience": "Rust users and event organizers",
      "contribution_url": null,
      "code_of_conduct_url": null
    },
    {
      "id": "rust-users",
      "name": "Rust Users Forum",
      "kind": "forum",
      "affiliation": "rust_project",
      "region": "global",
      "location": null,
      "source_languages": [
        "en"
      ],
      "topics": [
        "community",
        "api-design"
      ],
      "url": "https://users.rust-lang.org/",
      "discovery_source_id": null,
      "purpose": "Ask questions about using Rust.",
      "first_step": "Search for your question, then prepare a small example and the result you expected.",
      "access": {
        "mode": "online",
        "cost": null,
        "spoken_languages": null,
        "captions": null,
        "eligibility": null,
        "equipment": null,
        "venue": null,
        "room": null
      },
      "activity": {
        "observed_on": null,
        "evidence_url": "https://users.rust-lang.org/",
        "note": "Participation information inspected; no recent activity date established."
      },
      "review": {
        "checked_on": "2026-10-16",
        "next_review_on": "2027-01-14",
        "source_review": "page_checked",
        "evidence_urls": [
          "https://users.rust-lang.org/",
          "https://rust-lang.org/community/"
        ],
        "limits": [
          "The community page establishes the forum route; individual answers are not official language guarantees."
        ]
      },
      "audience": "people using Rust",
      "contribution_url": null,
      "code_of_conduct_url": null
    },
    {
      "id": "rust-internals",
      "name": "Rust Internals Forum",
      "kind": "forum",
      "affiliation": "rust_project",
      "region": "global",
      "location": null,
      "source_languages": [
        "en"
      ],
      "topics": [
        "types",
        "compilers"
      ],
      "url": "https://internals.rust-lang.org/",
      "discovery_source_id": null,
      "purpose": "Follow development of Rust itself.",
      "first_step": "Read the relevant design discussion and its context before proposing a change.",
      "access": {
        "mode": "online",
        "cost": null,
        "spoken_languages": null,
        "captions": null,
        "eligibility": null,
        "equipment": null,
        "venue": null,
        "room": null
      },
      "activity": {
        "observed_on": null,
        "evidence_url": "https://internals.rust-lang.org/",
        "note": "Participation information inspected; no recent activity date established."
      },
      "review": {
        "checked_on": "2026-10-16",
        "next_review_on": "2027-01-14",
        "source_review": "page_checked",
        "evidence_urls": [
          "https://internals.rust-lang.org/",
          "https://rust-lang.org/community/"
        ],
        "limits": [
          "Discussion and proposals do not establish released language behavior."
        ]
      },
      "audience": "people following Rust language and compiler design",
      "contribution_url": null,
      "code_of_conduct_url": null
    },
    {
      "id": "types-team",
      "name": "Rust Types Team",
      "kind": "team",
      "affiliation": "rust_project",
      "region": "global",
      "location": null,
      "source_languages": [
        "en"
      ],
      "topics": [
        "types",
        "compilers"
      ],
      "url": "https://github.com/rust-lang/types-team",
      "discovery_source_id": null,
      "purpose": "Follow trait-system design and implementation.",
      "first_step": "Read one meeting note; use the linked t-types Zulip stream for context.",
      "access": {
        "mode": "online",
        "cost": null,
        "spoken_languages": null,
        "captions": null,
        "eligibility": null,
        "equipment": null,
        "venue": null,
        "room": null
      },
      "activity": {
        "observed_on": null,
        "evidence_url": "https://github.com/rust-lang/types-team",
        "note": "Participation information inspected; no recent activity date established."
      },
      "review": {
        "checked_on": "2026-10-16",
        "next_review_on": "2027-01-14",
        "source_review": "page_checked",
        "evidence_urls": [
          "https://github.com/rust-lang/types-team"
        ],
        "limits": [
          "The repository invites observers; current meeting time must be checked in its calendar."
        ]
      },
      "audience": "readers exploring traits and type-system design",
      "contribution_url": null,
      "code_of_conduct_url": null
    },
    {
      "id": "embedded-wg",
      "name": "Embedded Working Group",
      "kind": "team",
      "affiliation": "rust_project",
      "region": "global",
      "location": null,
      "source_languages": [
        "en"
      ],
      "topics": [
        "embedded",
        "hardware",
        "robotics"
      ],
      "url": "https://rust-embedded.org/",
      "discovery_source_id": null,
      "purpose": "Find embedded Rust discussions, meetings, and contribution routes.",
      "first_step": "Open the linked agenda or help-wanted list and choose a hardware or documentation question.",
      "access": {
        "mode": "online",
        "cost": null,
        "spoken_languages": null,
        "captions": null,
        "eligibility": null,
        "equipment": null,
        "venue": null,
        "room": null
      },
      "activity": {
        "observed_on": null,
        "evidence_url": "https://rust-embedded.org/",
        "note": "Participation information inspected; no recent activity date established."
      },
      "review": {
        "checked_on": "2026-10-16",
        "next_review_on": "2027-01-14",
        "source_review": "page_checked",
        "evidence_urls": [
          "https://rust-embedded.org/"
        ],
        "limits": [
          "The page says Tuesday 20:00 CET and Berlin time; confirm the current agenda and daylight-saving interpretation."
        ]
      },
      "audience": "embedded developers and documentation contributors",
      "contribution_url": null,
      "code_of_conduct_url": null
    },
    {
      "id": "tokio",
      "name": "Tokio contributors",
      "kind": "project",
      "affiliation": "project",
      "region": "global",
      "location": null,
      "source_languages": [
        "en"
      ],
      "topics": [
        "async",
        "production-reliability",
        "observability"
      ],
      "url": "https://github.com/tokio-rs/tokio/blob/master/CONTRIBUTING.md",
      "discovery_source_id": null,
      "purpose": "Discuss and improve async Rust infrastructure.",
      "first_step": "Read the contribution guide and describe one reproducible runtime or documentation problem.",
      "access": {
        "mode": "online",
        "cost": null,
        "spoken_languages": null,
        "captions": null,
        "eligibility": null,
        "equipment": null,
        "venue": null,
        "room": null
      },
      "activity": {
        "observed_on": null,
        "evidence_url": "https://github.com/tokio-rs/tokio/blob/master/CONTRIBUTING.md",
        "note": "Participation information inspected; no recent activity date established."
      },
      "review": {
        "checked_on": "2026-10-16",
        "next_review_on": "2027-01-14",
        "source_review": "page_checked",
        "evidence_urls": [
          "https://github.com/tokio-rs/tokio/blob/master/CONTRIBUTING.md"
        ],
        "limits": [
          "The guide links Discord; no response time or currently available issue is promised."
        ]
      },
      "audience": "async Rust users and contributors",
      "contribution_url": "https://github.com/tokio-rs/tokio/blob/master/CONTRIBUTING.md",
      "code_of_conduct_url": null
    },
    {
      "id": "rig",
      "name": "Rig community",
      "kind": "project",
      "affiliation": "project",
      "region": "global",
      "location": null,
      "source_languages": [
        "en"
      ],
      "topics": [
        "production-reliability",
        "api-design"
      ],
      "url": "https://rig.rs/",
      "discovery_source_id": null,
      "purpose": "Explore Rust libraries and examples for agents.",